Должность,professionalroleidЗарплата,Опыт,Компания,Дата обьявления,Район,Тип занятости,Тип занятости2,Ключевые навыки,Ссылка
Администратор салона красоты,8,от 200 000 до 240 000 KZT на руки,не требуется,ИП СОТНИКОВА,Вакансия опубликована 13 мая 2023 в Астане,"Астана, улица Толе Би, 46",полный день,"Полная занятость, полный день","Консультирование клиентов по телефону;Улыбчивость;Умение расставлять приоритеты;Русский язык;Казахский язык;Умение работать в коллективе;входящие звонки;способность анализировать проблемы, эффективно искать пути их разрешения;способность быстро обучаться и легко воспринимать крупные объемы информации;Способность быстро обучаться;Пользователь ПК;Работа в команде;Грамотная речь;Опрятность;Дружелюбность;",https://almaty.hh.kz/vacancy/80384234
Оператор производственной линии (Астана),85,от 250 000 до 300 000 KZT на руки,не требуется,ТОО АМК-Метиз,Вакансия опубликована 11 мая 2023 в Астане,Алматы,полный день,"Полная занятость, полный день",умение работать в коллективе;,https://almaty.hh.kz/vacancy/80302696
SMM-менеджер/контент-менеджер/мобилограф,3,от 150 000 до 350 000 KZT до вычета налогов,не требуется,Частная компания Investroom Ltd,Вакансия опубликована 14 мая 2023 в Астане,Алматы,полный день,"Полная занятость, полный день",E9,https://almaty.hh.kz/vacancy/79399306
Бизнес-ассистент,3,от 100 000 до 200 000 KZT на руки,не требуется,ИП JAZY,Вакансия опубликована 10 мая 2023 в Астане,"Нур-Султан (Астана), жилой комплекс Абу-Даби Плаза",гибкий график,"Полная занятость, гибкий график",Смм;Ассистент;Навыки презентации;Создание контента;исполнение поручений руководителя;Организаторские навыки;,https://almaty.hh.kz/vacancy/80247213
Specialist on service contract,40,з/п не указана,не требуется,Nazarbayev University,Вакансия опубликована 15 мая 2023 в Астане,"Астана, проспект Кабанбай батыра, 53",полный день,"Проектная работа/разовое задание, полный день",Английский — C1 — Продвинутый;,https://almaty.hh.kz/vacancy/80428238
"Инженер технической поддержки, удаленная работа + выезды (IT-компания ЛЕММА)",121,от 560 USD до вычета налогов,не требуется,Первый Бит,Вакансия опубликована 12 мая 2023 в Астане,Алматы,удаленная работа,"Полная занятость, удаленная работа",E9,https://almaty.hh.kz/vacancy/80339149
Менеджер по видеонаблюдению,40,от 180 000 до 210 000 KZT до вычета налогов,не требуется,ИП Avrora Fashion Gallery (ИП Пурей Е.И.),Вакансия опубликована 14 мая 2023 в Астане,Алматы,полный день,"Полная занятость, полный день",E9,https://almaty.hh.kz/vacancy/80025228
Торговый представитель,129,от 250 000 до 350 000 KZT до вычета налогов,не требуется,ИП Кондренко,Вакансия опубликована 27 апреля 2023 в Астане,Алматы,полный день,"Полная занятость, полный день",E9,https://almaty.hh.kz/vacancy/78810068
Специалист по оценке смартфонов в ломбард/Начинающий специалист,57,от 200 000 до 220 000 KZT на руки,не требуется,ТОО THE BEST SELLER,Вакансия опубликована 16 мая 2023 в Астане,"Астана, улица Сыганак, 64/1",сменный график,"Полная занятость, сменный график",E9,https://almaty.hh.kz/vacancy/80472248
Ученик Ювелира-монтировщика,40,от 100 000 руб. до вычета налогов,не требуется,ООО Костромской ювелирный завод Каратов,Вакансия опубликована 2 мая 2023 в Астане,Алматы,полный день,"Стажировка, полный день",Работа в команде;Работа с большим объемом информации;Обучение и развитие;MS PowerPoint;Internet;,https://almaty.hh.kz/vacancy/79060975
Оптометрист с опытом работы в оптике,40,от 200 000 до 350 000 KZT до вычета налогов,не требуется,ИП МАК Макаров А.В.,Вакансия опубликована 16 мая 2023 в Астане,"Алматы, Райымбек батыра, проспект Райымбека, 167",полный день,"Полная занятость, полный день",Пользователь ПК;Работа в команде;Грамотная речь;Умение принимать решения;Поиск информации в интернет;,https://almaty.hh.kz/vacancy/78898817
Специалист по монтажу и обслуживанию ОВиК,40,з/п не указана,не требуется,"Small, ТМ (Скиф Сауда, ТОО)",Вакансия опубликована 18 апреля 2023 в Астане,Алматы,полный день,"Полная занятость, полный день",E9,https://almaty.hh.kz/vacancy/77695692
Администратор в Барбершоп,8,от 160 000 до 300 000 KZT на руки,не требуется,ИП Salta Rauan,Вакансия опубликована 10 мая 2023 в Астане,"Астана, улица Нажимеденова, 20",полный день,"Полная занятость, полный день",Работа с большим объемом информации;Клиентоориентированность;Многозадачность;Умение планировать;Уверенный пользователь ПК;Ориентация на результат;Управление персоналом;Ведение отчетности;Yclients;Внимательность к мелочам;Продажа услуг;принимать решения и за их результаты отвечать самостоятельно;Продажи;amoCRM;Казахский — A1 — Начальный;Русский — A1 — Начальный;,https://almaty.hh.kz/vacancy/80253498
Менеджер со знанием китайского языка,8,от 300 000 до 350 000 KZT на руки,не требуется,ТОО Sungrow Qurylys,Вакансия опубликована 11 мая 2023 в Астане,"Астана, проспект Тауелсиздик, 41",полный день,"Полная занятость, полный день",Перевод;Административная поддержка иностранного сотрудника;Администрирование;Английский язык;Устный перевод;,https://almaty.hh.kz/vacancy/80311563
Ювелир-мастер,40,от 50 000 до 120 000 руб. до вычета налогов,не требуется,ИП Давудов Б.Д,Вакансия опубликована 23 апреля 2023 в Астане,Алматы,полный день,"Полная занятость, полный день",E9,https://almaty.hh.kz/vacancy/79695653
Администратор стоматологической клиники,8,от 140 000 KZT на руки,не требуется,ИП Dent house,Вакансия опубликована 2 мая 2023 в Астане,"Астана, улица Достык, 10",полный день,"Полная занятость, полный день",E9,https://almaty.hh.kz/vacancy/79969382
Сервисный инженер,111,з/п не указана,не требуется,ТОО TerraPoint,Вакансия опубликована 27 апреля 2023 в Астане,"Астана, улица Амангельды Иманова, 13",полный день,"Полная занятость, полный день",E9,https://almaty.hh.kz/vacancy/79871641
Монтажник слаботочных систем,78,з/п не указана,не требуется,ИП EveResT Service,Вакансия опубликована 29 апреля 2023 в Астане,Алматы,полный день,"Полная занятость, полный день","Коммуникабельность, ответственность;Пользователь ПК;Работа в команде;Грамотная речь;Добропорядочность;",https://almaty.hh.kz/vacancy/79942197
