Должность,professionalroleid,Зарплата,Опыт,Компания,Дата обьявления,Район,Тип занятости,Тип занятости2,Ключевые навыки,Ссылка
Тайный покупатель,40,от 100 000 KZT на руки,не требуется,ООО 4Service Holdings GmbH,Вакансия опубликована 29 апреля 2023 в Темиртау,Алматы,полный день,"Частичная занятость, полный день",E9,https://almaty.hh.kz/vacancy/78792263
Сварщик,109,от 500 000 до 900 000 руб. на руки,не требуется,ТОО DIPCO,Вакансия опубликована 22 мая 2023 в Темиртау,Темиртау,Вахтовый метод,"Полная занятость, Вахтовый метод",Пользователь ПК;Охрана труда и техника безопасности;Работа в команде;Навыки работы с первичной документацией;Умение работать в коллективе;,https://almaty.hh.kz/vacancy/80808995
Супервизор,40,з/п не указана,не требуется,ТОО СЖС Казахстан ЛТД,Вакансия опубликована 26 мая 2023 в Темиртау,Алматы,сменный график,"Полная занятость, сменный график",E9,https://almaty.hh.kz/vacancy/81098284
"Торговый представитель (Ariel, Fairy, Gillette, Pampers, Head & Shoulders)",129,до 433 000 KZT до вычета налогов,не требуется,ТОО Apple City Corps,Вакансия опубликована 27 мая 2023 в Темиртау,Алматы,полный день,"Полная занятость, полный день",Навыки продаж;Управление временем;Навыки делового общения;,https://almaty.hh.kz/vacancy/78599883
Персональный менеджер (Темиртау),57,з/п не указана,не требуется,ТОО Микрофинансовая организация KMF(КМФ),Вакансия опубликована 26 мая 2023 в Темиртау,Алматы,полный день,"Полная занятость, полный день",Клиентоориентированность;Аналитическое мышление;Активные продажи;Кредитные договоры;,https://almaty.hh.kz/vacancy/81065953
Пеший исследователь в Яндекс Карты,40,от 20 000 до 45 000 руб. на руки,не требуется,Яндекс Крауд,Вакансия опубликована 26 мая 2023 в Темиртау,Алматы,гибкий график,"Частичная занятость, гибкий график",E9,https://almaty.hh.kz/vacancy/79931806
Заправщик АЗС,40,от 150 000 KZT на руки,не требуется,ТОО Гелиос,Вакансия опубликована 15 мая 2023 в Темиртау,Алматы,сменный график,"Полная занятость, сменный график",E9,https://almaty.hh.kz/vacancy/80401372
Менеджер по работе с клиентами в фото-копи центре (оператор печати),40,от 120 000 до 200 000 KZT на руки,не требуется,ИП CENTER FOTO (Шадурин),Вакансия опубликована 26 мая 2023 в Темиртау,Алматы,сменный график,"Полная занятость, сменный график",Коммуникабельность;Тактичность;Ответственность;Навыки межличностного общения;,https://almaty.hh.kz/vacancy/79951652
"Специалист по земельным ресурсам, Юридическая служба",146,з/п не указана,не требуется,АО АрселорМиттал Темиртау,Вакансия опубликована 16 мая 2023 в Темиртау,Алматы,полный день,"Полная занятость, полный день",Знание законодательства;Земельное право;Землепользование;Деловая переписка;,https://almaty.hh.kz/vacancy/80484076
Слесарь по контрольно-измерительным приборам и автоматике,115,з/п не указана,не требуется,АО АрселорМиттал Темиртау,Вакансия опубликована 26 мая 2023 в Темиртау,Сарань,полный день,"Полная занятость, полный день",E9,https://almaty.hh.kz/vacancy/80585415
Оператор,84,з/п не указана,не требуется,ТОО Бюро Веритас Казахстан Индастриал Сервисез,Вакансия опубликована 10 мая 2023 в Темиртау,Алматы,сменный график,"Полная занятость, сменный график","Ответственный подход к работе;Отличное знание ПК;Работа в команде;Работа с базами данных;Коммуникабельность, ответственность;Excel;",https://almaty.hh.kz/vacancy/80209555
Пешеход-исследователь для Яндекс Карт,40,от 20 000 до 45 000 руб. на руки,не требуется,Яндекс Крауд,Вакансия опубликована 26 мая 2023 в Темиртау,Алматы,гибкий график,"Частичная занятость, гибкий график",E9,https://almaty.hh.kz/vacancy/79931889
Шиномонтажник-грузчик,40,от 200 000 до 260 000 KZT до вычета налогов,не требуется,ТОО ЭЙКОС,Вакансия опубликована 23 мая 2023 в Темиртау,Алматы,полный день,"Полная занятость, полный день",Выносливость;Работать в команде;Стабильность;Навыки обслуживания клиентов;,https://almaty.hh.kz/vacancy/79136993
Пешеходный агент-исследователь Яндекс Карт,40,от 20 000 до 45 000 руб. на руки,не требуется,Яндекс Крауд,Вакансия опубликована 2 мая 2023 в Темиртау,Алматы,гибкий график,"Частичная занятость, гибкий график",E9,https://almaty.hh.kz/vacancy/79982209
Специалист по качеству Поиска со знанием казахского языка,40,от 30 000 руб. на руки,не требуется,Яндекс Крауд,Вакансия опубликована 17 мая 2023 в Темиртау,Алматы,удаленная работа,"Частичная занятость, удаленная работа",E9,https://almaty.hh.kz/vacancy/80609893
Исследователь Яндекс Карт,40,от 20 000 до 45 000 руб. на руки,не требуется,Яндекс Крауд,Вакансия опубликована 25 мая 2023 в Темиртау,Алматы,гибкий график,"Частичная занятость, гибкий график",E9,https://almaty.hh.kz/vacancy/79931849
Формовщик железобетонных изделий,85,от 200 000 KZT на руки,не требуется,ТОО NORD Production Group,Вакансия опубликована 15 мая 2023 в Темиртау,"Темиртау, проспект Мира, 265",полный день,"Полная занятость, полный день",Бетонные работы;Работа в команде;,https://almaty.hh.kz/vacancy/78113272
Специалист по сбору данных для Яндекс Карт,40,от 20 000 до 45 000 руб. на руки,не требуется,Яндекс Крауд,Вакансия опубликована 16 мая 2023 в Темиртау,Алматы,гибкий график,"Частичная занятость, гибкий график",E9,https://almaty.hh.kz/vacancy/80482544
Инспектор ЛПЦ (листо-прокатного цеха),149,от 160 000 до 180 000 KZT на руки,не требуется,ТОО СЖС Казахстан ЛТД,Вакансия опубликована 15 мая 2023 в Темиртау,"Темиртау, проспект Республики, 1/2, 4 этаж",полный день,"Полная занятость, полный день",Ведение отчетности;Умение работать в коллективе;,https://almaty.hh.kz/vacancy/79183615
Исследователь города в Яндекс Карты,40,от 20 000 до 45 000 руб. на руки,не требуется,Яндекс Крауд,Вакансия опубликована 26 мая 2023 в Темиртау,Алматы,гибкий график,"Частичная занятость, гибкий график",E9,https://almaty.hh.kz/vacancy/79931868
Токарь,128,з/п не указана,не требуется,АО Карцемент,Вакансия опубликована 3 мая 2023 в Темиртау,посёлок Актау,полный день,"Полная занятость, полный день",E9,https://almaty.hh.kz/vacancy/80019270
Менеджер по туризму,40,от 100 000 до 350 000 KZT на руки,не требуется,ТОО Temir Travel Company,Вакансия опубликована 25 мая 2023 в Темиртау,Алматы,полный день,"Полная занятость, полный день",Активные продажи;Телефонные переговоры;Деловая переписка;Ответственность;Стрессоустойчивость;умение вести диалог;Ориентация на результат;Мотивация;Уверенный пользователь ПК;,https://almaty.hh.kz/vacancy/81014435
Торговый представитель в г. Темиртау,129,от 150 000 до 250 000 KZT до вычета налогов,не требуется,ТОО Компания ВладИра,Вакансия опубликована 15 мая 2023 в Темиртау,"Караганда, проспект Нурсултана Назарбаева, 53/1",полный день,"Полная занятость, полный день",E9,https://almaty.hh.kz/vacancy/80440066
Электрик/автоматчик по ГПМ,169,от 300 000 до 500 000 KZT на руки,не требуется,ТОО КазМеталлургАвтоматика,Вакансия опубликована 26 мая 2023 в Темиртау,Алматы,полный день,"Полная занятость, полный день",E9,https://almaty.hh.kz/vacancy/81114380
Менеджер по туризму,40,от 70 000 до 350 000 KZT на руки,не требуется,ТОО Temir Travel Company,Вакансия опубликована 2 мая 2023 в Темиртау,Алматы,полный день,"Полная занятость, полный день",Активные продажи;Телефонные переговоры;Деловая переписка;Ответственность;Стрессоустойчивость;умение вести диалог;Ориентация на результат;Мотивация;Уверенный пользователь ПК;,https://almaty.hh.kz/vacancy/79997685
Оператор по отгрузке готовой продукции,84,з/п не указана,не требуется,CAC,Вакансия опубликована 18 мая 2023 в Темиртау,Алматы,сменный график,"Полная занятость, сменный график",E9,https://almaty.hh.kz/vacancy/80661672
Электромонтажник слаботочных сетей,143,от 200 000 до 250 000 KZT на руки,не требуется,ТОО Альянс строй сервис,Вакансия опубликована 22 мая 2023 в Темиртау,Алматы,полный день,"Полная занятость, полный день",E9,https://almaty.hh.kz/vacancy/80795039
Электромонтажник,40,от 100 000 до 120 000 KZT до вычета налогов,не требуется,ТОО AYNALI SECURITY,Вакансия опубликована 16 мая 2023 в Темиртау,"Темиртау, улица Ушинского, 4",полный день,"Полная занятость, полный день",Работа в команде;Электротехнические работы;Умение планировать;Умение работать в условиях многозадачности;,https://almaty.hh.kz/vacancy/80473280
