Должность,professionalroleid,Зарплата,Компания,Дата обьявления,Район,Тип занятости,Тип занятости2,Ключевые навыки,Ссылка,Мера содействия занятости,Специальность
Учитель казахского языка и литературы,Образование и воспитание,от 103 500 тенге,"Товарищество с ограниченной ответственностью ""Учебно-репетиторский центр ""Учазия""""",Вакансия опубликована 14.03.2023,Адреса нет,полный день,Проектная работа,Работа с обучаемыми;,https://enbek.kz/ru/vacancy/uchitel-kazakhskogo-yazyka-i-literatury~2982680,Молодежная практика,
Вожатый,Образование и воспитание,от 103 500 тенге,"Товарищество с ограниченной ответственностью ""Учебно-репетиторский центр ""Учазия""""",Вакансия опубликована 14.03.2023,Адреса нет,полный день,Проектная работа,Проведение групповых и индивидуальных занятий;,https://enbek.kz/ru/vacancy/vozhatyi~2982682,Первое рабочее место,
Учитель иностранного языка,Образование и воспитание,от 103 500 тенге,"Товарищество с ограниченной ответственностью ""Учебно-репетиторский центр ""Учазия""""",Вакансия опубликована 14.03.2023,Адреса нет,полный день,Проектная работа,Работа с обучаемыми;,https://enbek.kz/ru/vacancy/uchitel-inostrannogo-yazyka~2982683,Первое рабочее место,
Помощник юриста,Юриспруденция,от 103 500 тенге,"Товарищество с ограниченной ответственностью ""Петропавловский электротехнический завод""",Вакансия опубликована 14.03.2023,Адреса нет,полный день,Проектная работа,"Регистрация юридических лиц, эмиссий ценных акций;",https://enbek.kz/ru/vacancy/pomoshchnik-yurista~2972073,Молодежная практика,Юриспруденция
Логопед-дефектолог,Образование и воспитание,от 103 500 тенге,"Общественное объединение ""Мой ребенок""",Вакансия опубликована 07.03.2023,Адреса нет,полный день,Проектная работа,Работа с учащимися с особыми потребностями;,https://enbek.kz/ru/vacancy/logoped-defektolog~2970657,Молодежная практика,
Детский психолог,Образование и воспитание,от 103 500 тенге,"Общественное объединение ""Мой ребенок""",Вакансия опубликована 07.03.2023,Адреса нет,полный день,Проектная работа,Оценка психологического состояния учащегося;,https://enbek.kz/ru/vacancy/detskii-psikholog~2970658,Молодежная практика,
Помощник бухгалтера,Финансы и бухучет,от 103 500 тенге,ИП ГАСАНОВ З.М.,Вакансия опубликована 07.03.2023,Адреса нет,полный день,Проектная работа,Организация бухгалтерского учета и финансово-хозяйственной деятельности;,https://enbek.kz/ru/vacancy/pomoshchnik-bukhgaltera~2970528,Молодежная практика,Финансы
PR-менеджер,Маркетинг и СМИ,от 103 500 тенге,ИП ГАСАНОВ З.М.,Вакансия опубликована 07.03.2023,Адреса нет,полный день,Проектная работа,Проведение рекламных презентаций для клиентов;,https://enbek.kz/ru/vacancy/pr-menedzher~2970530,Первое рабочее место,Журналистика
Электрик по эксплуатации электрических сетей,Энергетика,от 103 500 тенге,ИП ГАСАНОВ З.М.,Вакансия опубликована 07.03.2023,Адреса нет,полный день,Проектная работа,Электромонтаж кабельных сетей;,https://enbek.kz/ru/vacancy/elektrik-po-ekspluatacii-elektricheskikh-setei~2970531,Первое рабочее место,Сервисное обслуживание/производство
Техник-электрик,Энергетика,от 103 500 тенге,ИП УШАКОВ АЛЕКСАНДР СЕРГЕЕВИЧ,Вакансия опубликована 26.02.2023,Адреса нет,полный день,Проектная работа,"ТО, замена приборов и измерение электрических параметров;",https://enbek.kz/ru/vacancy/tekhnik-elektrik~2951939,Молодежная практика,Сервисное обслуживание/производство
Техник-теплотехник,Энергетика,от 103 500 тенге,ИП УШАКОВ АЛЕКСАНДР СЕРГЕЕВИЧ,Вакансия опубликована 26.02.2023,Адреса нет,полный день,Проектная работа,Эксплуатация силовых приводов и оборудования насосных установок;,https://enbek.kz/ru/vacancy/tekhnik-teplotekhnik~2951930,Молодежная практика,Сервисное обслуживание/производство
Офис-менеджер,HR и секретариат,от 103 500 тенге,ИП БОНДАРЦЕВ П.М.,Вакансия опубликована 17.02.2023,Адреса нет,полный день,Проектная работа,Администрирование канцелярских и офисных принадлежностей;,https://enbek.kz/ru/vacancy/ofis-menedzher~2935224,Первое рабочее место,Менеджмент
Делопроизводитель,HR и секретариат,от 103 500 тенге,ИП БОНДАРЦЕВ П.М.,Вакансия опубликована 17.02.2023,Адреса нет,полный день,Проектная работа,Учет и регистрация документов;,https://enbek.kz/ru/vacancy/deloproizvoditel~2935225,Первое рабочее место,Менеджмент
Маркетолог,Маркетинг и СМИ,от 103 500 тенге,ИП БОНДАРЦЕВ П.М.,Вакансия опубликована 17.02.2023,Адреса нет,полный день,Проектная работа,Проведение переговоров и формирование коммерческих документов и соглашений;,https://enbek.kz/ru/vacancy/marketolog~2935226,Молодежная практика,Журналистика
Бухгалтер,Финансы и бухучет,от 103 500 тенге,ИП БОНДАРЦЕВ П.М.,Вакансия опубликована 17.02.2023,Адреса нет,полный день,Проектная работа,"Эксплуатация контрольно-кассовой техники (ККТ), выполнение расчета с покупателями;",https://enbek.kz/ru/vacancy/bukhgalter~2935227,Молодежная практика,Финансы
Техник-программист,IT и телекоммуникации,от 103 500 тенге,ИП БОНДАРЦЕВ П.М.,Вакансия опубликована 17.02.2023,Адреса нет,полный день,Проектная работа,Проведение технического обслуживания оборудования;,https://enbek.kz/ru/vacancy/tekhnik-programmist~2935228,Молодежная практика,IT
Фармацевт (средней квалификации),Медицина и фармацевтика,от 103 500 тенге,"Петропавловский филиал товарищества с ограниченной ответственностью ""ФАРМАКОМ""",Вакансия опубликована 16.02.2023,Адреса нет,полный день,Проектная работа,Знание фармакологии;,https://enbek.kz/ru/vacancy/farmacevt-(srednei-kvalifikacii)~2934295,Первое рабочее место,Медицина
Инспектор по кадрам,HR и секретариат,от 103 500 тенге,Республиканское государственное учреждение «Департамент Агентства Республики Казахстан по противодействию коррупции (Антикоррупционной службы) по Северо-Казахстанской области»,Вакансия опубликована 16.02.2023,Адреса нет,полный день,Проектная работа,"Подбор, отбор, расстановка кадров;",https://enbek.kz/ru/vacancy/inspektor-po-kadram~2932051,Молодежная практика,Менеджмент
Бухгалтер,Финансы и бухучет,от 103 500 тенге,Республиканское государственное учреждение «Департамент Агентства Республики Казахстан по противодействию коррупции (Антикоррупционной службы) по Северо-Казахстанской области»,Вакансия опубликована 16.02.2023,Адреса нет,полный день,Проектная работа,Работа в программе 1С:Бухгалтерия;,https://enbek.kz/ru/vacancy/bukhgalter~2932052,Молодежная практика,Финансы
Термист,Производство,от 103 500 тенге,"Товарищество с ограниченной ответственностью ""ARSGroup service (АРСГрупп сервис)""",Вакансия опубликована 16.02.2023,Адреса нет,полный день,Проектная работа,Подача и посадка металла в нагревательные устройства;,https://enbek.kz/ru/vacancy/termist~2931816,Первое рабочее место,Сервисное обслуживание/производство
Шлифовщик,Производство,от 103 500 тенге,"Товарищество с ограниченной ответственностью ""ARSGroup service (АРСГрупп сервис)""",Вакансия опубликована 16.02.2023,Адреса нет,полный день,Проектная работа,Шлифовальная обработка и доводка деталей;,https://enbek.kz/ru/vacancy/shlifovshchik~2931817,Первое рабочее место,Сервисное обслуживание/производство
Токарь,Производство,от 103 500 тенге,"Товарищество с ограниченной ответственностью ""ARSGroup service (АРСГрупп сервис)""",Вакансия опубликована 16.02.2023,Адреса нет,полный день,Проектная работа,"Обработка на токарных, фрезерных, сверлильных, шлифовальных и др. станках;",https://enbek.kz/ru/vacancy/tokar~2931818,Первое рабочее место,Сервисное обслуживание/производство
Графический дизайнер,IT и телекоммуникации,от 103 500 тенге,"Коммунальное государственное учреждение ""Молодежный ресурсный центр города Петропавловска"" коммунального государственного учреждения ""Отдел внутренней политики акимата города Петропавловска""",Вакансия опубликована 15.02.2023,Адреса нет,полный день,Проектная работа,Подготовка дизайна эскизов мультимедиа;,https://enbek.kz/ru/vacancy/graficheskii-dizainer~2930821,Первое рабочее место,IT
Юрист,Юриспруденция,от 103 500 тенге,"Товарищество с ограниченной ответственностью ""СК Качество""",Вакансия опубликована 09.02.2023,Адреса нет,полный день,Проектная работа,Контроль соблюдения законодательных актов;,https://enbek.kz/ru/vacancy/yurist~2905027,Молодежная практика,Юриспруденция
Экономист,Финансы и бухучет,от 103 500 тенге,"Товарищество с ограниченной ответственностью ""СК Качество""",Вакансия опубликована 09.02.2023,Адреса нет,полный день,Проектная работа,Финансовое планирование;,https://enbek.kz/ru/vacancy/ekonomist~2905029,Молодежная практика,Финансы
Бухгалтер,Финансы и бухучет,от 103 500 тенге,"Товарищество с ограниченной ответственностью ""СК Качество""",Вакансия опубликована 09.02.2023,Адреса нет,полный день,Проектная работа,Работа в программе 1С:Бухгалтерия;,https://enbek.kz/ru/vacancy/bukhgalter~2905030,Молодежная практика,Финансы
Менеджер (фармацевтика),Медицина и фармацевтика,от 103 500 тенге,"Товарищество с ограниченной ответственностью ""Smart City NK""",Вакансия опубликована 08.02.2023,Адреса нет,полный день,Проектная работа,"Обеспечение отделения лекарственными средствами, изделиями медицинского назначения и медицинской техникой;",https://enbek.kz/ru/vacancy/menedzher-(farmacevtika)~2915197,Первое рабочее место,Медицина
Делопроизводитель,HR и секретариат,от 103 500 тенге,"Товарищество с ограниченной ответственностью ""Құрылыс-Сервис-СК""",Вакансия опубликована 07.02.2023,Адреса нет,полный день,Проектная работа,Регистрация входящей и исходящей информации;,https://enbek.kz/ru/vacancy/deloproizvoditel~2909596,Первое рабочее место,Менеджмент
Инженер ПТО,Строительство и архитектура,от 103 500 тенге,"Товарищество с ограниченной ответственностью ""Құрылыс-Сервис-СК""",Вакансия опубликована 07.02.2023,Адреса нет,полный день,Проектная работа,Составление сметной стоимости строительства и разработка документации;,https://enbek.kz/ru/vacancy/inzhener-pto~2909591,Молодежная практика,Строительство и архитектура
Делопроизводитель,HR и секретариат,от 103 500 тенге,Государственное учреждение «Департамент по обеспечению качества в сфере образования Северо-Казахстанской области Комитета по обеспечению качества в сфере образования Министерства просвещения Республики Казахстан»,Вакансия опубликована 07.02.2023,Адреса нет,полный день,Проектная работа,Регистрация входящей и исходящей информации;,https://enbek.kz/ru/vacancy/deloproizvoditel~2909088,Молодежная практика,Менеджмент
Специалист по сопровождению программного обеспечения,IT и телекоммуникации,от 103 500 тенге,"Товарищество с ограниченной ответственностью ""Арида-Софт""",Вакансия опубликована 06.02.2023,Адреса нет,полный день,Проектная работа,Работа с программным обеспечением;,https://enbek.kz/ru/vacancy/specialist-po-soprovozhdeniyu-programmnogo-obespecheniya~2905813,Молодежная практика,IT
Инженер технической поддержки в области телекоммуникаций,IT и телекоммуникации,от 103 500 тенге,"Товарищество с ограниченной ответственностью ""Цифровой дом""",Вакансия опубликована 06.02.2023,Адреса нет,полный день,Проектная работа,"Установка, наладка, настройка и сопровождение аппаратного и программного обеспечения;",https://enbek.kz/ru/vacancy/inzhener-tekhnicheskoi-podderzhki-v-oblasti-telekommunikacii~2906868,Молодежная практика,IT
Техник-электрик,Энергетика,от 103 500 тенге,"Товарищество с ограниченной ответственностью ""Петропавловский электротехнический завод""",Вакансия опубликована 06.02.2023,Адреса нет,полный день,Проектная работа,"Монтаж, сборка и регулировка электрооборудования;",https://enbek.kz/ru/vacancy/tekhnik-elektrik~2905830,Молодежная практика,Сервисное обслуживание/производство
Бухгалтер,Финансы и бухучет,от 103 500 тенге,"Коммунальное государственное учреждение «Отдел строительства, архитектуры и градостроительства акимата города Петропавловска»",Вакансия опубликована 06.02.2023,Адреса нет,полный день,Проектная работа,Начисление и перечисление налоговых и других обязательных платежей;,https://enbek.kz/ru/vacancy/bukhgalter~2905952,Молодежная практика,Финансы
Инженер по землеустройству,Строительство и архитектура,от 103 500 тенге,"""BASTAU""",Вакансия опубликована 06.02.2023,Адреса нет,полный день,Проектная работа,Планирование инженерных изыскательских работ на территории КДС;,https://enbek.kz/ru/vacancy/inzhener-po-zemleustroistvu~2905185,Первое рабочее место,Строительство и архитектура
Помощник бухгалтера,Финансы и бухучет,от 103 500 тенге,"Коммунальное государственное учреждение ""Отдел предпринимательства, сельского хозяйства и ветеринарии акимата города Петропавловска""",Вакансия опубликована 06.02.2023,Адреса нет,полный день,Проектная работа,Владение языками;,https://enbek.kz/ru/vacancy/pomoshchnik-bukhgaltera~2905060,Молодежная практика,Финансы
Делопроизводитель,HR и секретариат,от 103 500 тенге,"Коммунальное государственное учреждение ""Отдел предпринимательства, сельского хозяйства и ветеринарии акимата города Петропавловска""",Вакансия опубликована 06.02.2023,Адреса нет,полный день,Проектная работа,Владение языками;,https://enbek.kz/ru/vacancy/deloproizvoditel~2905061,Молодежная практика,Менеджмент
Экономист,Финансы и бухучет,от 103 500 тенге,"Республиканское государственное учреждение ""Департамент Бюро национальной статистики Агентства по стратегическому планированию и реформам Республики Казахстан по Северо-Казахстанской области""",Вакансия опубликована 01.02.2023,Адреса нет,полный день,Проектная работа,обработка информации;,https://enbek.kz/ru/vacancy/ekonomist~2881809,Молодежная практика,Финансы
Бухгалтер (средней квалификации),Финансы и бухучет,от 103 500 тенге,ИП УШАКОВ АЛЕКСАНДР СЕРГЕЕВИЧ,Вакансия опубликована 27.01.2023,Адреса нет,полный день,Проектная работа,Составление баланса и оперативных сводных отчетов;,https://enbek.kz/ru/vacancy/bukhgalter-(srednei-kvalifikacii)~2873199,Первое рабочее место,Финансы
Экономист-аналитик,Финансы и бухучет,от 103 500 тенге,"Республиканское государственное учреждение ""Департамент Комитета по регулированию естественных монополий Министерства национальной экономики Республики Казахстан по Северо-Казахстанской области""",Вакансия опубликована 27.01.2023,Адреса нет,полный день,Проектная работа,Экономический анализ хозяйственно-финансовой деятельности;,https://enbek.kz/ru/vacancy/ekonomist-analitik~2875227,Первое рабочее место,Финансы
Врач-эпидемиолог,Медицина и фармацевтика,от 103 500 тенге,"Филиал Республиканского государственного предприятия на праве хозяйственного ведения ""Национальный центр экспертизы"" Комитета санитарно-эпидемиологического контроля Министерства здравоохранения Республики Казахстан ""Центр дезинфекции по Северо-Казахстанской области""",Вакансия опубликована 25.01.2023,Адреса нет,полный день,Проектная работа,Эпидемиологическое обследование;,https://enbek.kz/ru/vacancy/vrach-epidemiolog~2876652,Первое рабочее место,Медицина
Маркетолог,Маркетинг и СМИ,от 103 500 тенге,"Филиал Республиканского государственного предприятия на праве хозяйственного ведения ""Национальный центр экспертизы"" Комитета санитарно-эпидемиологического контроля Министерства здравоохранения Республики Казахстан ""Центр дезинфекции по Северо-Казахстанской области""",Вакансия опубликована 25.01.2023,Адреса нет,полный день,Проектная работа,Умение продвигать товары и услуги;,https://enbek.kz/ru/vacancy/marketolog~2876653,Первое рабочее место,Журналистика
Мастер цеха (обрабатывающая промышленность),Производство,от 103 500 тенге,CREATIV KZ,Вакансия опубликована 24.01.2023,Адреса нет,полный день,Проектная работа,Контроль состояния технологического оборудования;,https://enbek.kz/ru/vacancy/master-cekha-(obrabatyvayushchaya-promyshlennost)~2874571,Первое рабочее место,Сервисное обслуживание/производство
