Должность,professionalroleid,Зарплата,Компания,Дата обьявления,Район,Тип занятости,Тип занятости2,Ключевые навыки,Ссылка,Мера содействия занятости,Специальность
Медицинская(ий) сестра/брат,Медицина и фармацевтика,от 103 500 тенге,"Товарищество с ограниченной ответственностью ""Инвитро Петропавловск""",Вакансия опубликована 29.05.2023,Адреса нет,полный день,Проектная работа,Сестринский уход;,https://enbek.kz/ru/vacancy/medicinskaya(ii)-sestra-brat~3124341,Молодежная практика,Медицина
Фотограф,Культура и спорт,от 103 500 тенге,ИП Әуелбек,Вакансия опубликована 22.05.2023,Адреса нет,полный день,Проектная работа,"Подготовка фотографий для рекламы или в других коммерческих, промышленных или научных целях;",https://enbek.kz/ru/vacancy/fotograf~3100758,Первое рабочее место,
Бухгалтер,Финансы и бухучет,от 103 500 тенге,ИП Әуелбек,Вакансия опубликована 22.05.2023,Адреса нет,полный день,Проектная работа,Начисление и перечисление налоговых и других обязательных платежей;,https://enbek.kz/ru/vacancy/bukhgalter~3100759,Первое рабочее место,Финансы
Преподаватель ритмики и хореографии,Образование и воспитание,от 103 500 тенге,"Логопедический кабинет ""Говоруша""",Вакансия опубликована 19.05.2023,Адреса нет,полный день,Проектная работа,Основы музыкальной грамоты и хореографии;,https://enbek.kz/ru/vacancy/prepodavatel-ritmiki-i-khoreografii~3107436,Первое рабочее место,
Учитель начальных классов,Образование и воспитание,от 103 500 тенге,ИП КУНЕНОВА ГАЛИЯ КАНЫШЕВНА,Вакансия опубликована 18.05.2023,Адреса нет,полный день,Проектная работа,Обеспечение методического сопровождения педагогического процесса;,https://enbek.kz/ru/vacancy/uchitel-nachalnykh-klassov~3103842,Молодежная практика,
Медицинская(ий) сестра/брат,Медицина и фармацевтика,от 103 500 тенге,"Товарищество с ограниченной ответственностью ""NordFarmRetail""",Вакансия опубликована 12.05.2023,Адреса нет,полный день,Проектная работа,Подготовка пациента к лечению;,https://enbek.kz/ru/vacancy/medicinskaya(ii)-sestra-brat~3081338,Молодежная практика,Медицина
Бухгалтер-кассир,Финансы и бухучет,от 103 500 тенге,"Петропавловский филиал товарищества с ограниченной ответственностью ""ФАРМАКОМ""",Вакансия опубликована 11.05.2023,Адреса нет,полный день,Проектная работа,Ведение бухгалтерского учета и отчетности;,https://enbek.kz/ru/vacancy/bukhgalter-kassir~3089631,Молодежная практика,Финансы
Личный помощник,HR и секретариат,от 103 500 тенге,"ИП ""Step by step""",Вакансия опубликована 05.05.2023,Адреса нет,полный день,Проектная работа,"Учет и хранение, передача документов в подразделения;",https://enbek.kz/ru/vacancy/lichnyi-pomoshchnik~3082001,Первое рабочее место,Менеджмент
Экономист,Финансы и бухучет,от 103 500 тенге,"Коммунальное государственное учреждение ""Управление финансов акимата Северо-Казахстанской области""",Вакансия опубликована 05.05.2023,Адреса нет,полный день,Проектная работа,Финансовое планирование;,https://enbek.kz/ru/vacancy/ekonomist~3079847,Молодежная практика,Финансы
Бухгалтер,Финансы и бухучет,от 103 500 тенге,"Товарищество с ограниченной ответственностью ""Петропавловский электротехнический завод""",Вакансия опубликована 05.05.2023,Адреса нет,полный день,Проектная работа,Ведение бухгалтерского учета и отчетности;,https://enbek.kz/ru/vacancy/bukhgalter~3080099,Молодежная практика,Финансы
Аналитик-маркетолог,Маркетинг и СМИ,от 103 500 тенге,"ИП """"LuckAni""""",Вакансия опубликована 04.05.2023,Адреса нет,полный день,Проектная работа,"Поиск, сбор и анализ информации;",https://enbek.kz/ru/vacancy/analitik-marketolog~3079886,Первое рабочее место,Журналистика
Ассистент (общий профиль),HR и секретариат,от 103 500 тенге,"ИП ""Интеллектуальная академия SMART PEOPLE""",Вакансия опубликована 04.05.2023,Адреса нет,полный день,Проектная работа,"Прием и доставка (вручение) корреспонденции, уведомлений, извещений;",https://enbek.kz/ru/vacancy/assistent-(obshchii-profil)~3079615,Первое рабочее место,Менеджмент
Лаборант по обслуживанию испытаний,Наука и консалтинг,от 103 500 тенге,"Северо-Казахстанский филиал акционерного общества ""Национальный центр экспертизы и сертификации""",Вакансия опубликована 04.05.2023,Адреса нет,полный день,Проектная работа,Испытания сложных электроаппаратов и приборов;,https://enbek.kz/ru/vacancy/laborant-po-obsluzhivaniyu-ispytanii~3078181,Молодежная практика,Наука
Сварщик,Строительство и архитектура,от 103 500 тенге,АТЛАНТ,Вакансия опубликована 26.04.2023,Адреса нет,полный день,Проектная работа,"Ручная дуговая сварка плавящимся покрытым электродом (РДС) сварных швов элементов конструкции (изделий, узлов, деталей);",https://enbek.kz/ru/vacancy/svarshchik~3063460,Молодежная практика,Строительство и архитектура
Юридический секретарь,Юриспруденция,от 103 500 тенге,"Товарищество с ограниченной ответственностью ""Арида-Софт""",Вакансия опубликована 26.04.2023,Адреса нет,полный день,Проектная работа,Разработка документов;,https://enbek.kz/ru/vacancy/yuridicheskii-sekretar~3063457,Молодежная практика,Юриспруденция
Учитель начальных классов,Образование и воспитание,от 103 500 тенге,"Логопедический кабинет ""Говоруша""",Вакансия опубликована 26.04.2023,Адреса нет,полный день,Проектная работа,Организация учебно-воспитательного процесса;,https://enbek.kz/ru/vacancy/uchitel-nachalnykh-klassov~3062677,Первое рабочее место,
Воспитатель,Образование и воспитание,от 103 500 тенге,"Логопедический кабинет ""Говоруша""",Вакансия опубликована 26.04.2023,Адреса нет,полный день,Проектная работа,Знание методов диагностики личностного потенциала обучающего;,https://enbek.kz/ru/vacancy/vospitatel~3062681,Молодежная практика,
Бухгалтер (средней квалификации),Финансы и бухучет,от 103 500 тенге,"Государственное учреждение ""Прокуратура Северо-Казахстанской области""",Вакансия опубликована 26.04.2023,Адреса нет,полный день,Проектная работа,Учет товарно-материальных ценностей;,https://enbek.kz/ru/vacancy/bukhgalter-(srednei-kvalifikacii)~3062329,Молодежная практика,Финансы
Юрист,Юриспруденция,от 103 500 тенге,"Республиканское государственное учреждение ""Департамент Агентства Республики Казахстан по делам государственной службы по Северо-Казахстанской области""",Вакансия опубликована 24.04.2023,Адреса нет,полный день,Проектная работа,Ведение и составление документов;,https://enbek.kz/ru/vacancy/yurist~3051843,Молодежная практика,Юриспруденция
Техник-технолог (общий профиль),Производство,от 103 500 тенге,"Некоммерческое акционерное общество ""Северо-Казахстанский университет имени Манаша Козыбаева""",Вакансия опубликована 21.04.2023,Адреса нет,полный день,Проектная работа,Контроль исправности работ оборудования;,https://enbek.kz/ru/vacancy/tekhnik-tekhnolog-(obshchii-profil)~3047026,Молодежная практика,Сервисное обслуживание/производство
Менеджер по персоналу,HR и секретариат,от 103 500 тенге,"Некоммерческое акционерное общество ""Северо-Казахстанский университет имени Манаша Козыбаева""",Вакансия опубликована 21.04.2023,Адреса нет,полный день,Проектная работа,Ведение делопроизводства;,https://enbek.kz/ru/vacancy/menedzher-po-personalu~3047027,Первое рабочее место,Менеджмент
Секретарь,HR и секретариат,от 103 500 тенге,ИП Кожахметов,Вакансия опубликована 21.04.2023,Адреса нет,полный день,Проектная работа,Встреча и учет посетителей;,https://enbek.kz/ru/vacancy/sekretar~3049573,Молодежная практика,Менеджмент
Графический дизайнер,IT и телекоммуникации,от 103 500 тенге,ИП Омаров СД,Вакансия опубликована 19.04.2023,Адреса нет,полный день,Проектная работа,художник;,https://enbek.kz/ru/vacancy/graficheskii-dizainer~3050279,Молодежная практика,IT
Медицинская(ий) сестра/брат,Медицина и фармацевтика,от 103 500 тенге,"Товарищество с ограниченной ответственностью ""Достық-СҚО""",Вакансия опубликована 17.04.2023,Адреса нет,полный день,Проектная работа,Оказание лечебно-профилактической помощи;,https://enbek.kz/ru/vacancy/medicinskaya(ii)-sestra-brat~3046807,Первое рабочее место,Медицина
Администратор клиники,Медицина и фармацевтика,от 103 500 тенге,"Товарищество с ограниченной ответственностью ""Достық-СҚО""",Вакансия опубликована 17.04.2023,Адреса нет,полный день,Проектная работа,Регистрация входящей и исходящей информации;,https://enbek.kz/ru/vacancy/administrator-kliniki~3046808,Первое рабочее место,Медицина
Врач-терапевт,Медицина и фармацевтика,от 103 500 тенге,"Товарищество с ограниченной ответственностью ""Достық-СҚО""",Вакансия опубликована 17.04.2023,Адреса нет,полный день,Проектная работа,"Оказание квалифицированной, скорой и других видов медицинской помощи;",https://enbek.kz/ru/vacancy/vrach-terapevt~3046809,Первое рабочее место,Медицина
"Санитар, санитарка",Медицина и фармацевтика,от 103 500 тенге,"Товарищество с ограниченной ответственностью ""Достық-СҚО""",Вакансия опубликована 17.04.2023,Адреса нет,полный день,Проектная работа,Контроль за соблюдением санитарных норм;,"https://enbek.kz/ru/vacancy/sanitar,-sanitarka~3046810",Первое рабочее место,Медицина
Врач-терапевт,Медицина и фармацевтика,от 103 500 тенге,"Товарищество с ограниченной ответственностью ""Достық-СҚО""",Вакансия опубликована 17.04.2023,Адреса нет,полный день,Проектная работа,Подготовка пациента к лечению;,https://enbek.kz/ru/vacancy/vrach-terapevt~3046817,Молодежная практика,Медицина
Медицинская(ий) сестра/брат,Медицина и фармацевтика,от 103 500 тенге,"Товарищество с ограниченной ответственностью ""Достық-СҚО""",Вакансия опубликована 17.04.2023,Адреса нет,полный день,Проектная работа,Амбулаторный прием и обслуживание больных на дому;,https://enbek.kz/ru/vacancy/medicinskaya(ii)-sestra-brat~3046818,Молодежная практика,Медицина
Учитель музыки,Образование и воспитание,от 103 500 тенге,ИП Могунова,Вакансия опубликована 17.04.2023,Адреса нет,полный день,Проектная работа,Владение различными стилями и направлениями в музыке;,https://enbek.kz/ru/vacancy/uchitel-muzyki~3046789,Молодежная практика,
Детский психолог,Образование и воспитание,от 103 500 тенге,ИП Могунова,Вакансия опубликована 17.04.2023,Адреса нет,полный день,Проектная работа,Отбор психологического инструментария исследования;,https://enbek.kz/ru/vacancy/detskii-psikholog~3046790,Молодежная практика,
Воспитатель,Образование и воспитание,от 103 500 тенге,ИП Могунова,Вакансия опубликована 17.04.2023,Адреса нет,полный день,Проектная работа,Знание методов диагностики личностного потенциала обучающего;,https://enbek.kz/ru/vacancy/vospitatel~3046791,Молодежная практика,
Логопед-дефектолог,Образование и воспитание,от 103 500 тенге,"Логопедический кабинет ""Говоруша""",Вакансия опубликована 17.04.2023,Адреса нет,полный день,Проектная работа,Оказание помощи инвалидам и лицам с ограниченными возможностями здоровья;,https://enbek.kz/ru/vacancy/logoped-defektolog~3045597,Молодежная практика,
Инструктор по физической культуре,Образование и воспитание,от 103 500 тенге,"Логопедический кабинет ""Говоруша""",Вакансия опубликована 17.04.2023,Адреса нет,полный день,Проектная работа,Планирование тренировочного процесса;,https://enbek.kz/ru/vacancy/instruktor-po-fizicheskoi-kulture~3045598,Молодежная практика,
Детский психолог,Медицина и фармацевтика,от 103 500 тенге,"Логопедический кабинет ""Говоруша""",Вакансия опубликована 17.04.2023,Адреса нет,полный день,Проектная работа,Исследование динамики психических нарушений;,https://enbek.kz/ru/vacancy/detskii-psikholog~3045603,Первое рабочее место,Медицина
Инструктор по физической культуре,Образование и воспитание,от 103 500 тенге,"Логопедический кабинет ""Говоруша""",Вакансия опубликована 17.04.2023,Адреса нет,полный день,Проектная работа,Проведение групповых и индивидуальных занятий;,https://enbek.kz/ru/vacancy/instruktor-po-fizicheskoi-kulture~3045604,Первое рабочее место,
Помощник юриста,Юриспруденция,от 103 500 тенге,"Северо-Казахстанский областной филиал общественного объединения ""Партия ""AMANAT""",Вакансия опубликована 03.04.2023,Адреса нет,полный день,Проектная работа,"Разработка положений о сделках (договорах), связанных с приобретением или отчуждением имущества;",https://enbek.kz/ru/vacancy/pomoshchnik-yurista~3012627,Молодежная практика,Юриспруденция
Делопроизводитель,HR и секретариат,от 103 500 тенге,"Северо-Казахстанский филиал акционерного общества ""Казахстанская аграрная экспертиза""",Вакансия опубликована 29.03.2023,Адреса нет,полный день,Проектная работа,Ведение документации и формирование отчетности;,https://enbek.kz/ru/vacancy/deloproizvoditel~3003801,Молодежная практика,Менеджмент
Специалист по кадрам,HR и секретариат,от 103 500 тенге,"Коммунальное государственное учреждение ""Специализированная база акимата Северо-Казахстанской области"" коммунального государственного учреждения ""Аппарат акима Северо-Казахстанской области""",Вакансия опубликована 17.03.2023,Адреса нет,полный день,Проектная работа,Заключение трудовых договоров;,https://enbek.kz/ru/vacancy/specialist-po-kadram~2983341,Молодежная практика,Менеджмент
Юрист,Юриспруденция,от 103 500 тенге,"Коммунальное государственное учреждение ""Специализированная база акимата Северо-Казахстанской области"" коммунального государственного учреждения ""Аппарат акима Северо-Казахстанской области""",Вакансия опубликована 17.03.2023,Адреса нет,полный день,Проектная работа,Оказание правовой помощи в составлении юридических документов;,https://enbek.kz/ru/vacancy/yurist~2983342,Молодежная практика,Юриспруденция
Бухгалтер,Финансы и бухучет,от 103 500 тенге,"Коммунальное государственное учреждение ""Специализированная база акимата Северо-Казахстанской области"" коммунального государственного учреждения ""Аппарат акима Северо-Казахстанской области""",Вакансия опубликована 17.03.2023,Адреса нет,полный день,Проектная работа,Ведение бухгалтерского учета и отчетности;,https://enbek.kz/ru/vacancy/bukhgalter~2983343,Молодежная практика,Финансы
Помощник юриста,Юриспруденция,от 103 500 тенге,"Товарищество с ограниченной ответственностью ""Центр правовой защиты и консалтинга""",Вакансия опубликована 14.03.2023,Адреса нет,полный день,Проектная работа,"Регистрация юридических лиц, эмиссий ценных акций;",https://enbek.kz/ru/vacancy/pomoshchnik-yurista~2980523,Молодежная практика,Юриспруденция
Разработчик программного обеспечения,IT и телекоммуникации,от 103 500 тенге,"Товарищество с ограниченной ответственностью ""Центр правовой защиты и консалтинга""",Вакансия опубликована 14.03.2023,Адреса нет,полный день,Проектная работа,Составление алгоритма программного кода;,https://enbek.kz/ru/vacancy/razrabotchik-programmnogo-obespecheniya~2980525,Молодежная практика,IT
SMM-менеджер,Маркетинг и СМИ,от 103 500 тенге,"Товарищество с ограниченной ответственностью ""Центр правовой защиты и консалтинга""",Вакансия опубликована 14.03.2023,Адреса нет,полный день,Проектная работа,Умение продвигать товары и услуги;,https://enbek.kz/ru/vacancy/smm-menedzher~2980526,Молодежная практика,Журналистика
Учитель русского языка и литературы,Образование и воспитание,от 103 500 тенге,"Товарищество с ограниченной ответственностью ""Учебно-репетиторский центр ""Учазия""""",Вакансия опубликована 14.03.2023,Адреса нет,полный день,Проектная работа,Работа с обучаемыми;,https://enbek.kz/ru/vacancy/uchitel-russkogo-yazyka-i-literatury~2982678,Молодежная практика,
Учитель физической культуры и спорта,Образование и воспитание,от 103 500 тенге,"Товарищество с ограниченной ответственностью ""Учебно-репетиторский центр ""Учазия""""",Вакансия опубликована 14.03.2023,Адреса нет,полный день,Проектная работа,Оказание первой медицинской помощи;,https://enbek.kz/ru/vacancy/uchitel-fizicheskoi-kultury-i-sporta~2982679,Молодежная практика,
